{"bundle_id":"ardur-drp-v0.1-draft-10-implementation-fixtures","bundle_schema_version":"ardur.drp_implementation_fixture_bundle.v0.1","bundle_sha256":"9e6c5bd387d37b41e0acb68f86b077c5afc636eb88df8e6de8c2f0ee51ed2d7c","draft":{"name":"draft-nelson-agent-delegation-receipts","revision":"10","source":"https://datatracker.ietf.org/doc/draft-nelson-agent-delegation-receipts/10/","status":"active-individual-internet-draft"},"evidence_class":"implementation-self-test","external_implementations":[{"evidence":"Legacy fields, signatures, identifiers, and time-window shape do not satisfy the draft-10-pinned Ardur profile schema.","name":"authproof-sdk","relationship":"draft-author","revision":"ae1c56da7f55965c229d1b0a638d5390b4882123","source":"https://github.com/Commonguy25/authproof-sdk","status":"incompatible-wire"},{"evidence":"No independently maintained compatible verifier was identified or passed against this bundle.","name":"independent-verifier","relationship":"independent","revision":null,"source":null,"status":"not-demonstrated"}],"not_claimed":["generic DRP compatibility","IETF conformance","independent implementation interoperability","raw RFC 3161 proof verification"],"ok":true,"profile":"ardur.drp.v0.1","scenarios":[{"checks":{"attenuation_edges":2,"log_evidence":3,"orchestrator_signatures":2,"receipt_chain_evidence":0,"receipts":3,"revocation_evidence":3,"signatures":3},"decision":"PERMIT","description":"A valid root-child-grandchild profile chain permits the bounded action.","evidence_class":"implementation-self-test","expected_decision":"PERMIT","expected_reason_code":"verified","expected_receipt_id":"rec_40558892f22e1d9833807406ff61ee96a8f1918f3965d333a14879161ccfd206","reason_code":"verified","receipt_id":"rec_40558892f22e1d9833807406ff61ee96a8f1918f3965d333a14879161ccfd206","receipt_id_status":"verified","risk_class":"authorization_validity","scenario_id":"DRP-VALID-CHAIN","verifier_status":"pass"},{"checks":null,"decision":"DENY","description":"A correctly signed child that widens cwd authority beyond its parent denies.","evidence_class":"implementation-self-test","expected_decision":"DENY","expected_reason_code":"RESOURCE_BOUND_WIDENING","expected_receipt_id":"rec_29ff6a678de5d69a215bc0951c3671ebebaee521d3dcbb200b88fa4ee00a71e1","reason_code":"RESOURCE_BOUND_WIDENING","receipt_id":"rec_29ff6a678de5d69a215bc0951c3671ebebaee521d3dcbb200b88fa4ee00a71e1","receipt_id_status":"untrusted-input","risk_class":"authority_widening","scenario_id":"DRP-DENY-RESOURCE-WIDENING","verifier_status":"pass"},{"checks":null,"decision":"DENY","description":"A valid chain evaluated after the root time window denies.","evidence_class":"implementation-self-test","expected_decision":"DENY","expected_reason_code":"EXPIRED","expected_receipt_id":"rec_40558892f22e1d9833807406ff61ee96a8f1918f3965d333a14879161ccfd206","reason_code":"EXPIRED","receipt_id":"rec_40558892f22e1d9833807406ff61ee96a8f1918f3965d333a14879161ccfd206","receipt_id_status":"untrusted-input","risk_class":"temporal_validity","scenario_id":"DRP-DENY-EXPIRED","verifier_status":"pass"},{"checks":null,"decision":"DENY","description":"A chain with fresh authenticated revoked status for the child denies.","evidence_class":"implementation-self-test","expected_decision":"DENY","expected_reason_code":"REVOKED","expected_receipt_id":"rec_40558892f22e1d9833807406ff61ee96a8f1918f3965d333a14879161ccfd206","reason_code":"REVOKED","receipt_id":"rec_40558892f22e1d9833807406ff61ee96a8f1918f3965d333a14879161ccfd206","receipt_id_status":"untrusted-input","risk_class":"revocation","scenario_id":"DRP-DENY-REVOKED","verifier_status":"pass"},{"checks":null,"decision":"DENY","description":"A child under a parent that signs mode none denies.","evidence_class":"implementation-self-test","expected_decision":"DENY","expected_reason_code":"REDELEGATION_DENIED","expected_receipt_id":"rec_7bbda48ffdf46e22b7eeb0aef3ec88233aa75f0e61bd4c2a14b826e060a74400","reason_code":"REDELEGATION_DENIED","receipt_id":"rec_7bbda48ffdf46e22b7eeb0aef3ec88233aa75f0e61bd4c2a14b826e060a74400","receipt_id_status":"untrusted-input","risk_class":"redelegation","scenario_id":"DRP-DENY-NO-REDELEGATION","verifier_status":"pass"},{"checks":null,"decision":"DENY","description":"A child at its parent signed maximum delegation depth denies.","evidence_class":"implementation-self-test","expected_decision":"DENY","expected_reason_code":"REDELEGATION_DENIED","expected_receipt_id":"rec_b29c9cb77698fab7eba2217269cff03498df137949fb8b9df93c764bb60d0db8","reason_code":"REDELEGATION_DENIED","receipt_id":"rec_b29c9cb77698fab7eba2217269cff03498df137949fb8b9df93c764bb60d0db8","receipt_id_status":"untrusted-input","risk_class":"redelegation","scenario_id":"DRP-DENY-DEPTH-EXHAUSTED","verifier_status":"pass"},{"checks":null,"decision":"DENY","description":"The AuthProof SDK ae1c56 legacy wire fails the draft-10-pinned profile schema closed.","evidence_class":"implementation-self-test","expected_decision":"DENY","expected_reason_code":"SCHEMA_INVALID","expected_receipt_id":null,"reason_code":"SCHEMA_INVALID","receipt_id":null,"receipt_id_status":"absent","risk_class":"wire_compatibility","scenario_id":"DRP-DENY-AUTHPROOF-AE1C56-WIRE","verifier_status":"pass"}],"schema_version":"ardur.drp_implementation_fixture_report.v0.1","summary":{"failed":0,"passed":7,"total":7}}
